<?xml version="1.0" encoding="UTF-8"?>
<FlightsList xmlns:od="urn:schemas-microsoft-com:officedata" xmlns:xsi="http://www.w3.org/2001/XMLSchema-instance"  xsi:noNamespaceSchemaLocation="Flights.xsd" generated="2021-06-08T17:52:17">
<Flights>
<Flight>1</Flight>
<FDesc>Flight 1 - 4:20 - 5:00</FDesc>
<Teams>12</Teams>
<FDesc_Save>Flight 1 - 4:30 - 5:07</FDesc_Save>
<Group>1</Group>
<Group2>1</Group2>
</Flights>
<Flights>
<Flight>2</Flight>
<FDesc>Flight 2 - 5:10 - 6:00</FDesc>
<Teams>12</Teams>
<FDesc_Save>Flight 2 - 5:22 - 6:00</FDesc_Save>
<Group>1</Group>
<Group2>2</Group2>
</Flights>
<Flights>
<Flight>3</Flight>
<FDesc>Flight 3 - 4:20 - 5:00</FDesc>
<Teams>12</Teams>
<FDesc_Save>Flight 3 - 4:30 - 5:07</FDesc_Save>
<Group>2</Group>
<Group2>1</Group2>
</Flights>
<Flights>
<Flight>4</Flight>
<FDesc>Flight 4 - 5:10 - 6:00</FDesc>
<Teams>12</Teams>
<FDesc_Save>Flight 4 - 5:22 - 6:00</FDesc_Save>
<Group>2</Group>
<Group2>2</Group2>
</Flights>
</FlightsList>
